{
  "requirement_summary": "Build a simple product management system that can add, delete, update, search, and list products.",
  "components": [
    "ProductManager class",
    "Product data storage",
    "CRUD functions",
    "Command line demonstration"
  ],
  "design_plan": "Create a ProductManager class using an in-memory dictionary. Implement add_product, delete_product, update_product, search_product, and list_products methods. Add a simple main section to demonstrate the functions.",
  "dependencies": []
}
